Question,Answer
hello,Hello there! I'm Josefina. How can I assist you today?
hi,Hello there! I'm Josefina. How can I assist you today?
hey,Hello there! I'm Josefina. How can I assist you today?
what's up,"Not much, just here to chat. What's up with you?"
nice to meet you,"Nice to meet you too, I'm glad we're chatting."
pleased to meet you,"Nice to meet you too, I'm glad we're chatting."
good morning,Good morning! I hope your day is off to a great start.
good afternoon,Good afternoon! How's your day going so far?
good evening,Good evening! How was your day?
it is good,That's good to hear!
it is bad,I'm sorry to hear that.
how are you,"I am good, thank you, what about you?"
how are you doing,I'm functioning perfectly! How about you?
i'm bored,Let's fix that! What would you like to talk about?
i'm sad,I'm sorry to hear that.
i'm good,That's wonderful to hear!
not much,Just a normal day for you.
thank you,"You're very welcome, is there anything else I can help you with?"
thanks,My pleasure!
thank you so much,"You're very welcome, I'm always happy to help."
goodbye,"Goodbye, it was nice chatting, feel free to come back anytime."
bye,"Goodbye, it was nice chatting, feel free to come back anytime."
see you later,"See you later, take care."